{
  "schema": "stegverse.morrison-runtime.canonical-execution-evidence.v1",
  "suite_id": "morrison-runtime-commit-time-scope-v0.1",
  "repository": "Data-Continuation/formalism-tests",
  "commit_sha": "8d8cf3cdd99050afdba9b64ad3eca46b9babe13e",
  "execution_surface": "GITHUB_ACTIONS",
  "run_url": "https://github.com/Data-Continuation/formalism-tests/actions/runs/40967795588",
  "executed_at": "2026-10-29T22:41:50.153187+00:00",
  "commands": [
    "python tools/run_declared_tasks.py tools/tasks/morrison_runtime_commit_time_scope_tasks.json --task-id morrison_runtime_commit_time_scope_tests",
    "python tools/run_declared_tasks.py tools/tasks/morrison_runtime_commit_time_scope_tasks.json --task-id verify_morrison_runtime_commit_time_scope_artifacts",
    "python tools/run_declared_tasks.py tools/tasks/morrison_runtime_commit_time_scope_tasks.json --task-id check_morrison_runtime_canonical_evidence_gate"
  ],
  "task_results": {
    "morrison_runtime_commit_time_scope_tests": "PASS",
    "verify_morrison_runtime_commit_time_scope_artifacts": "PASS",
    "check_morrison_runtime_canonical_evidence_gate": "PASS"
  },
  "artifact_hashes": {
    "report_sha256": "47fe6f349b2a5f181c2653db8e874e7cd862287e69aa3ba80f762f4019079dd1",
    "receipts_sha256": "0993a3c118de08ea9a4bdb1aac93cad3363893c1bf0b573edc057dc247d73ce2",
    "verification_sha256": "7f067bf605d363850ead0acb6851ccc5d16aa3b90d07b96a35becf06f11fd3da",
    "canonical_evidence_gate_sha256": "e670e3487487db345fcd584526109cacad81d763b04415f6c1584b5da196eddf"
  },
  "artifact_equivalence": {
    "report": true,
    "receipts": true,
    "expected_outcomes": true,
    "canonical_evidence_gate": true
  },
  "authority_posture": "EXTERNAL_FRAMEWORK_COMPARATIVE_EVIDENCE_ONLY",
  "status": "VERIFIED_CANONICAL_RUN",
  "notes": [
    "Report and receipt outputs were byte-equivalent to their committed deterministic outputs before canonical capture.",
    "Expected-outcome mapping matched the committed artifact baseline.",
    "Canonical evidence-gate hash was pre-bound to the deterministic PASS gate output and verified after gate execution.",
    "This evidence grants no certification, endorsement, production-validation, release, or execution authority."
  ]
}
